{
  "$schema": "schemas/vectors.schema.json",
  "$comment": [
    "Bead's conformance vectors: the bytes of envelopes and what they say, written once and read by every implementation's tests.",
    "Bytes are hexadecimal, spaces aside; a bar parts a header from what follows it.",
    "A header is the fields an envelope's header carries. credential is its CREDENTIAL block: its scheme, NONE, OPAQUE, JWT or ELSEWHERE by name, a scheme to come by its number; OPAQUE's bytes and a scheme to come's in bytes, in hexadecimal, a JWT's in token, a character a byte.",
    "kind: REQUEST 16, RESULT 17, FAILURE 18, NOTIFICATION 19, CHUNK 20, CREDIT 21, CANCEL 22. scope: PROTOCOL 0, APPLICATION 1.",
    "A refusal names the protocol code a reader answers with; its detail, where given, is what the TypeScript implementation says, and is informative: an implementation compares the code.",
    "maximumEnvelopeBytes and maximumDetailBytes, where given, are the reader's bounds; where not, the vector is within any bound.",
    "side is the side that reads: a failure says which side raised it.",
    "clauses are the units of spec.md an entry checks: a clause, 9.2; an item of its numbered list, 9.2.5; a row of its table, counted from 1, 15.6.8.",
    "A JWT verdict gives a token, the keys, each a JWK with its issuer and its algorithm, the receiver's audience, or the set of them a relay that verifies holds, an array, any of which aud may name, and now, the wall clock's reading, which a test gives as W; then whether the token holds, with its session's identifier, its claims set and its end, in milliseconds since the epoch, or why it does not: the step of section 13.8 that refused it."
  ],
  "specVersion": "0.3.0",
  "headers": [
    {
      "name": "a request",
      "clauses": [
        "2.1",
        "3.1.1"
      ],
      "bytes": "A1 10 00 03  00 00 00 03  00 02 00 01",
      "header": {
        "callId": 3,
        "kind": 16,
        "procedureId": 1,
        "serviceId": 2
      }
    },
    {
      "name": "a result",
      "clauses": [
        "2.1",
        "3.1.2"
      ],
      "bytes": "A1 11 00 02  00 00 00 03",
      "header": {
        "callId": 3,
        "kind": 17
      }
    },
    {
      "name": "a failure",
      "clauses": [
        "2.1",
        "3.1.3"
      ],
      "bytes": "A1 12 00 02  00 00 00 03",
      "header": {
        "callId": 3,
        "kind": 18
      }
    },
    {
      "name": "a notification",
      "clauses": [
        "2.1",
        "3.1.4"
      ],
      "bytes": "A1 13 00 02  00 00 00 0D",
      "header": {
        "callId": 13,
        "kind": 19
      }
    },
    {
      "name": "a cancel",
      "clauses": [
        "2.1",
        "3.1.7"
      ],
      "bytes": "A1 16 00 02  00 00 00 05",
      "header": {
        "callId": 5,
        "kind": 22
      }
    },
    {
      "name": "a request with a destination",
      "clauses": [
        "4.1",
        "4.5"
      ],
      "bytes": "A1 10 02 04  00 00 00 09  00 02 00 07  00 00 00 05",
      "header": {
        "callId": 9,
        "destinationId": 5,
        "kind": 16,
        "procedureId": 7,
        "serviceId": 2
      }
    },
    {
      "name": "a request presenting an opaque token",
      "clauses": [
        "4.1",
        "4.4",
        "4.4.2"
      ],
      "bytes": "A1 10 08 08  00 00 00 03  00 02 00 01  00 01 00 10  00 01 02 03 04 05 06 07 08 09 0A 0B 0C 0D 0E 0F",
      "header": {
        "callId": 3,
        "credential": {
          "scheme": "OPAQUE",
          "bytes": "00 01 02 03 04 05 06 07 08 09 0A 0B 0C 0D 0E 0F"
        },
        "kind": 16,
        "procedureId": 1,
        "serviceId": 2
      }
    },
    {
      "name": "a result announcing a session",
      "clauses": [
        "4.1",
        "4.2.2",
        "4.4.2",
        "13.3"
      ],
      "bytes": "A1 11 08 07  00 00 00 03  00 01 00 10  00 01 02 03 04 05 06 07 08 09 0A 0B 0C 0D 0E 0F",
      "header": {
        "callId": 3,
        "credential": {
          "scheme": "OPAQUE",
          "bytes": "00 01 02 03 04 05 06 07 08 09 0A 0B 0C 0D 0E 0F"
        },
        "kind": 17
      }
    },
    {
      "name": "a result announcing that its session ended",
      "clauses": [
        "4.4.1",
        "13.3"
      ],
      "bytes": "A1 11 08 03  00 00 00 03  00 00 00 00",
      "header": {
        "callId": 3,
        "credential": {
          "scheme": "NONE"
        },
        "kind": 17
      }
    },
    {
      "name": "a failure announcing a session",
      "clauses": [
        "4.2.3",
        "4.4.2"
      ],
      "bytes": "A1 12 08 07  00 00 00 03  00 01 00 10  00 01 02 03 04 05 06 07 08 09 0A 0B 0C 0D 0E 0F",
      "header": {
        "callId": 3,
        "credential": {
          "scheme": "OPAQUE",
          "bytes": "00 01 02 03 04 05 06 07 08 09 0A 0B 0C 0D 0E 0F"
        },
        "kind": 18
      }
    },
    {
      "name": "a failure announcing that its session ended",
      "clauses": [
        "4.2.3",
        "4.4.1"
      ],
      "bytes": "A1 12 08 03  00 00 00 03  00 00 00 00",
      "header": {
        "callId": 3,
        "credential": {
          "scheme": "NONE"
        },
        "kind": 18
      }
    },
    {
      "name": "a request with a destination, presenting an opaque token after it",
      "clauses": [
        "4.1",
        "4.4.2",
        "4.5"
      ],
      "bytes": "A1 10 0A 09  00 00 00 07  00 02 00 01  00 00 00 0C  00 01 00 10  00 01 02 03 04 05 06 07 08 09 0A 0B 0C 0D 0E 0F",
      "header": {
        "callId": 7,
        "credential": {
          "scheme": "OPAQUE",
          "bytes": "00 01 02 03 04 05 06 07 08 09 0A 0B 0C 0D 0E 0F"
        },
        "destinationId": 12,
        "kind": 16,
        "procedureId": 1,
        "serviceId": 2
      }
    },
    {
      "name": "a request presenting a JWT, padded with one zero byte to its word",
      "clauses": [
        "4.4",
        "4.4.3"
      ],
      "bytes": "A1 10 08 31  00 00 00 03  00 02 00 01  00 02 00 B3  65 79 4A 30 65 58 41 69 4F 69 4A 4B 56 31 51 69 4C 41 30 4B 49 43 4A 68 62 47 63 69 4F 69 4A 49 55 7A 49 31 4E 69 4A 39 2E 65 79 4A 70 63 33 4D 69 4F 69 4A 71 62 32 55 69 4C 41 30 4B 49 43 4A 6C 65 48 41 69 4F 6A 45 7A 4D 44 41 34 4D 54 6B 7A 4F 44 41 73 44 51 6F 67 49 6D 68 30 64 48 41 36 4C 79 39 6C 65 47 46 74 63 47 78 6C 4C 6D 4E 76 62 53 39 70 63 31 39 79 62 32 39 30 49 6A 70 30 63 6E 56 6C 66 51 2E 64 42 6A 66 74 4A 65 5A 34 43 56 50 2D 6D 42 39 32 4B 32 37 75 68 62 55 4A 55 31 70 31 72 5F 77 57 31 67 46 57 46 4F 45 6A 58 6B  00",
      "header": {
        "callId": 3,
        "credential": {
          "scheme": "JWT",
          "token": "eyJ0eXAiOiJKV1QiLA0KICJhbGciOiJIUzI1NiJ9.eyJpc3MiOiJqb2UiLA0KICJleHAiOjEzMDA4MTkzODAsDQogImh0dHA6Ly9leGFtcGxlLmNvbS9pc19yb290Ijp0cnVlfQ.dBjftJeZ4CVP-mB92K27uhbUJU1p1r_wW1gFWFOEjXk"
        },
        "kind": 16,
        "procedureId": 1,
        "serviceId": 2
      }
    },
    {
      "name": "a request presenting a JWT of one byte, the least, padded with three",
      "clauses": [
        "4.4",
        "4.4.3"
      ],
      "bytes": "A1 10 08 05  00 00 00 03  00 02 00 01  00 02 00 01  61  00 00 00",
      "header": {
        "callId": 3,
        "credential": {
          "scheme": "JWT",
          "token": "a"
        },
        "kind": 16,
        "procedureId": 1,
        "serviceId": 2
      }
    },
    {
      "name": "a request presenting a JWT of 1,004 bytes, the most its header leaves",
      "clauses": [
        "4.3",
        "4.4",
        "4.4.3"
      ],